{
  "$schema": "http://json-schema.org/draft-07/schema#",
  "$id": "https://schemas.hl7v2-rs.org/evidence/corpus-summary/v1",
  "title": "HL7v2 Corpus Summary",
  "description": "Summary of a directory or file corpus of HL7 v2 messages.",
  "type": "object",
  "additionalProperties": false,
  "required": ["root", "file_count", "message_count", "parse_error_count", "total_bytes", "message_types", "segments", "field_presence", "parse_errors"],
  "properties": {
    "root": {"type": "string"},
    "file_count": {"type": "integer", "minimum": 0},
    "message_count": {"type": "integer", "minimum": 0},
    "parse_error_count": {"type": "integer", "minimum": 0},
    "total_bytes": {"type": "integer", "minimum": 0},
    "message_types": {"type": "array", "items": {"$ref": "#/definitions/count"}},
    "segments": {"type": "array", "items": {"$ref": "#/definitions/count"}},
    "field_presence": {"type": "array", "items": {"$ref": "#/definitions/field_presence"}},
    "parse_errors": {"type": "array", "items": {"$ref": "#/definitions/parse_failure"}}
  },
  "definitions": {
    "count": {
      "type": "object",
      "additionalProperties": false,
      "required": ["value", "count"],
      "properties": {
        "value": {"type": "string"},
        "count": {"type": "integer", "minimum": 0}
      }
    },
    "field_presence": {
      "type": "object",
      "additionalProperties": false,
      "required": ["path", "message_count", "occurrence_count"],
      "properties": {
        "path": {"type": "string"},
        "message_count": {"type": "integer", "minimum": 0},
        "occurrence_count": {"type": "integer", "minimum": 0}
      }
    },
    "parse_failure": {
      "type": "object",
      "additionalProperties": false,
      "required": ["path", "error"],
      "properties": {
        "path": {"type": "string"},
        "error": {"type": "string"}
      }
    }
  }
}
